{
  "generated_at": "2026-03-31",
  "changed_paths": [
    "crates/cargo-vrc/src/main.rs"
  ],
  "selected_arcs": [
    {
      "name": "cargo-vrc",
      "reason": "Matched owned paths crates/cargo-vrc/src/main.rs",
      "local_validate": [
        "cargo check -p cargo-vrc",
        "cargo test -p cargo-vrc",
        "cargo test -p cargo-vrc --doc"
      ],
      "boundary_validate": [],
      "public_api": true
    }
  ],
  "selected_tests": [
    {
      "arc": "cargo-vrc",
      "command": "cargo check -p cargo-vrc",
      "ring": "local",
      "selection_reason": "local proof is always required for matched ARCs"
    },
    {
      "arc": "cargo-vrc",
      "command": "cargo test -p cargo-vrc",
      "ring": "local",
      "selection_reason": "local proof is always required for matched ARCs"
    },
    {
      "arc": "cargo-vrc",
      "command": "cargo test -p cargo-vrc --doc",
      "ring": "doctest",
      "selection_reason": "local proof is always required for matched ARCs"
    }
  ],
  "stop_condition": "stop after local compile, tests, and doctests",
  "skipped_rings": [
    "reverse-dependency",
    "contract",
    "smoke",
    "full-e2e"
  ],
  "rationale": [
    "Selected cargo-vrc because Matched owned paths crates/cargo-vrc/src/main.rs"
  ]
}